{
  "$schema": "https://json-schema.org/draft/2020-12/schema",
  "title": "DomainModel",
  "type": "object",
  "required": ["app", "entities", "enums", "relationships"],
  "properties": {
    "app": {
      "type": "object",
      "required": ["name"],
      "properties": {
        "name": { "type": "string" },
        "version": { "type": "string" }
      },
      "additionalProperties": true
    },
    "entities": {
      "type": "array",
      "items": {
        "type": "object",
        "required": ["name", "fields"],
        "properties": {
          "name": { "type": "string" },
          "description": { "type": "string" },
          "fields": {
            "type": "array",
            "items": {
              "type": "object",
              "required": ["name", "type"],
              "properties": {
                "name": { "type": "string" },
                "type": { "type": "string" },
                "required": { "type": "boolean" },
                "notes": { "type": "string" }
              },
              "additionalProperties": true
            }
          }
        },
        "additionalProperties": true
      }
    },
    "enums": {
      "type": "array",
      "items": {
        "type": "object",
        "required": ["name", "values"],
        "properties": {
          "name": { "type": "string" },
          "values": { "type": "array", "items": { "type": "string" } }
        },
        "additionalProperties": true
      }
    },
    "relationships": {
      "type": "array",
      "items": {
        "type": "object",
        "required": ["from", "to", "type"],
        "properties": {
          "from": { "type": "string" },
          "to": { "type": "string" },
          "type": { "type": "string" },
          "field": { "type": "string" }
        },
        "additionalProperties": true
      }
    }
  },
  "additionalProperties": true
}
