{
  "app": {
    "name": "PST Coaching",
    "version": "4.0.0",
    "source": "PST_Mobile_PRD_Rev4.md"
  },
  "entities": [
    {
      "name": "User",
      "description": "Authenticated or guest person in PST app.",
      "fields": [
        {
          "name": "id",
          "type": "uuid",
          "required": true
        },
        {
          "name": "role",
          "type": "UserRole",
          "required": true
        },
        {
          "name": "language",
          "type": "LanguageCode",
          "required": true
        },
        {
          "name": "subscription_status",
          "type": "SubscriptionStatus",
          "required": true
        },
        {
          "name": "created_at",
          "type": "datetime",
          "required": true
        }
      ]
    },
    {
      "name": "UserSession",
      "description": "Token-backed session lifecycle.",
      "fields": [
        {
          "name": "id",
          "type": "uuid",
          "required": true
        },
        {
          "name": "user_id",
          "type": "uuid",
          "required": true
        },
        {
          "name": "expires_at",
          "type": "datetime",
          "required": true
        },
        {
          "name": "last_active_at",
          "type": "datetime",
          "required": true
        }
      ]
    },
    {
      "name": "DemographicProfile",
      "description": "Single-source demographic record from FR-E1-08.",
      "fields": [
        {
          "name": "user_id",
          "type": "uuid",
          "required": true
        },
        {
          "name": "age",
          "type": "integer",
          "required": true
        },
        {
          "name": "gender",
          "type": "GenderOption",
          "required": false
        },
        {
          "name": "country_code",
          "type": "string",
          "required": true
        },
        {
          "name": "updated_at",
          "type": "datetime",
          "required": true
        }
      ]
    },
    {
      "name": "AccessibilitySettings",
      "description": "Persistent accessibility preferences.",
      "fields": [
        {
          "name": "user_id",
          "type": "uuid",
          "required": true
        },
        {
          "name": "text_scale",
          "type": "number",
          "required": true
        },
        {
          "name": "high_contrast",
          "type": "boolean",
          "required": true
        },
        {
          "name": "reduce_motion",
          "type": "boolean",
          "required": true
        },
        {
          "name": "theme_mode",
          "type": "ThemeMode",
          "required": true
        }
      ]
    },
    {
      "name": "SubscriptionPlan",
      "description": "Commercial plan definition (individual/family/group).",
      "fields": [
        {
          "name": "id",
          "type": "uuid",
          "required": true
        },
        {
          "name": "plan_type",
          "type": "PlanType",
          "required": true
        },
        {
          "name": "seat_limit",
          "type": "integer",
          "required": true
        },
        {
          "name": "student_discount_eligible",
          "type": "boolean",
          "required": true
        }
      ]
    },
    {
      "name": "Subscription",
      "description": "Plan entitlement and billing state.",
      "fields": [
        {
          "name": "id",
          "type": "uuid",
          "required": true
        },
        {
          "name": "owner_user_id",
          "type": "uuid",
          "required": true
        },
        {
          "name": "plan_id",
          "type": "uuid",
          "required": true
        },
        {
          "name": "status",
          "type": "SubscriptionStatus",
          "required": true
        },
        {
          "name": "renewal_at",
          "type": "datetime",
          "required": false
        },
        {
          "name": "period_end_at",
          "type": "datetime",
          "required": false
        }
      ]
    },
    {
      "name": "AddOn",
      "description": "Optional add-on product bound to subscription.",
      "fields": [
        {
          "name": "id",
          "type": "uuid",
          "required": true
        },
        {
          "name": "code",
          "type": "AddOnCode",
          "required": true
        },
        {
          "name": "eligible_plan_types",
          "type": "PlanType[]",
          "required": true
        }
      ]
    },
    {
      "name": "Seat",
      "description": "Seat assignment in family/group plans.",
      "fields": [
        {
          "name": "id",
          "type": "uuid",
          "required": true
        },
        {
          "name": "subscription_id",
          "type": "uuid",
          "required": true
        },
        {
          "name": "assigned_user_id",
          "type": "uuid",
          "required": false
        },
        {
          "name": "status",
          "type": "SeatStatus",
          "required": true
        }
      ]
    },
    {
      "name": "Journey",
      "description": "Coach-curated mixed program.",
      "fields": [
        {
          "name": "id",
          "type": "uuid",
          "required": true
        },
        {
          "name": "title",
          "type": "string",
          "required": true
        },
        {
          "name": "duration_days",
          "type": "integer",
          "required": false
        },
        {
          "name": "level",
          "type": "string",
          "required": false
        }
      ]
    },
    {
      "name": "Module",
      "description": "Thematic module containing ordered packages.",
      "fields": [
        {
          "name": "id",
          "type": "uuid",
          "required": true
        },
        {
          "name": "title",
          "type": "string",
          "required": true
        },
        {
          "name": "description",
          "type": "string",
          "required": false
        }
      ]
    },
    {
      "name": "Package",
      "description": "Module sub-unit with readings and exercises.",
      "fields": [
        {
          "name": "id",
          "type": "uuid",
          "required": true
        },
        {
          "name": "module_id",
          "type": "uuid",
          "required": true
        },
        {
          "name": "title",
          "type": "string",
          "required": true
        },
        {
          "name": "order_index",
          "type": "integer",
          "required": true
        }
      ]
    },
    {
      "name": "Ebook",
      "description": "Digital book within library.",
      "fields": [
        {
          "name": "id",
          "type": "uuid",
          "required": true
        },
        {
          "name": "title",
          "type": "string",
          "required": true
        },
        {
          "name": "category",
          "type": "string",
          "required": false
        },
        {
          "name": "total_pages",
          "type": "integer",
          "required": true
        }
      ]
    },
    {
      "name": "EbookChapter",
      "description": "Table-of-contents chapter entry.",
      "fields": [
        {
          "name": "id",
          "type": "uuid",
          "required": true
        },
        {
          "name": "ebook_id",
          "type": "uuid",
          "required": true
        },
        {
          "name": "title",
          "type": "string",
          "required": true
        },
        {
          "name": "order_index",
          "type": "integer",
          "required": true
        }
      ]
    },
    {
      "name": "Workshop",
      "description": "Rev4 workshop root object.",
      "fields": [
        {
          "name": "id",
          "type": "uuid",
          "required": true
        },
        {
          "name": "title",
          "type": "string",
          "required": true
        },
        {
          "name": "theme",
          "type": "string",
          "required": true
        },
        {
          "name": "target_audience",
          "type": "string",
          "required": false
        },
        {
          "name": "total_duration_minutes",
          "type": "integer",
          "required": false
        },
        {
          "name": "expected_outputs",
          "type": "string[]",
          "required": false
        }
      ]
    },
    {
      "name": "WorkshopStage",
      "description": "Workshop stage (concept/camp/facilitator/workbook/follow-up).",
      "fields": [
        {
          "name": "id",
          "type": "uuid",
          "required": true
        },
        {
          "name": "workshop_id",
          "type": "uuid",
          "required": true
        },
        {
          "name": "stage_number",
          "type": "integer",
          "required": true
        },
        {
          "name": "stage_type",
          "type": "WorkshopStageType",
          "required": true
        },
        {
          "name": "title",
          "type": "string",
          "required": true
        }
      ]
    },
    {
      "name": "WorkshopSession",
      "description": "Time-boxed session for camp and facilitator flows.",
      "fields": [
        {
          "name": "id",
          "type": "uuid",
          "required": true
        },
        {
          "name": "workshop_stage_id",
          "type": "uuid",
          "required": true
        },
        {
          "name": "day_index",
          "type": "integer",
          "required": false
        },
        {
          "name": "slot",
          "type": "SessionSlot",
          "required": false
        },
        {
          "name": "duration_minutes",
          "type": "integer",
          "required": false
        }
      ]
    },
    {
      "name": "WorkshopContentBlock",
      "description": "Structured block such as verse, explanation, bridge, exercise, output.",